{
    "$schema": "urn:pickle:schemas:artefacts:domains:business:conceptual:BUS-CAP",
    "audience": [
        "Enterprise Architect",
        "Business Architect",
        "Chief Operating Officer"
    ],
    "author": [
        "Business Architect",
        "Business Analyst"
    ],
    "capabilities": [
        {
            "id": "CAP-001",
            "name": "Customer Management",
            "level": 1,
            "description": "Acquiring, serving, and retaining wholesale offtakers and power-purchase counterparties across all channels.",
            "importance": "differentiating"
        },
        {
            "id": "CAP-002",
            "name": "Energy Generation",
            "level": 1,
            "description": "Producing electrical and thermal energy from conventional and renewable sources.",
            "importance": "strategic"
        },
        {
            "id": "CAP-003",
            "name": "Energy Trading & Risk Management",
            "level": 1,
            "description": "Buying, selling, and hedging energy and related products in wholesale and retail markets.",
            "importance": "strategic"
        },
        {
            "id": "CAP-004",
            "name": "Plant Operations",
            "level": 1,
            "description": "Operating generation fleet to move energy reliably from generation to consumption.",
            "importance": "foundational"
        },
        {
            "id": "CAP-005",
            "name": "Asset Management",
            "level": 1,
            "description": "Planning, acquiring, operating, maintaining, and decommissioning physical assets across the value chain.",
            "importance": "foundational"
        },
        {
            "id": "CAP-006",
            "name": "Wholesale Settlement",
            "level": 1,
            "description": "Pricing energy products, metering consumption, generating bills, and collecting payment.",
            "importance": "foundational"
        },
        {
            "id": "CAP-007",
            "name": "Regulatory & Compliance",
            "level": 1,
            "description": "Maintaining the right to operate via licensing, reporting, audits, and safety obligations.",
            "importance": "foundational"
        },
        {
            "id": "CAP-008",
            "name": "Sustainability & Decarbonisation",
            "level": 1,
            "description": "Reducing emissions, increasing renewable share, and meeting evolving ESG obligations.",
            "importance": "strategic"
        },
        {
            "id": "CAP-009",
            "name": "Enterprise Support",
            "level": 1,
            "description": "Cross-cutting business support: finance, HR, IT, legal, and procurement.",
            "importance": "foundational"
        },
        {
            "id": "CAP-001-01",
            "name": "Acquire Customer",
            "level": 2,
            "parent-id": "CAP-001",
            "description": "Generate, qualify, and convert prospects into customers across channels."
        },
        {
            "id": "CAP-001-02",
            "name": "Service Customer",
            "level": 2,
            "parent-id": "CAP-001",
            "description": "Respond to enquiries, complaints, and service requests across channels."
        },
        {
            "id": "CAP-001-03",
            "name": "Manage Customer Insight",
            "level": 2,
            "parent-id": "CAP-001",
            "description": "Understand customer needs, behaviours, and value, and act on that insight."
        },
        {
            "id": "CAP-001-04",
            "name": "Retain Customer",
            "level": 2,
            "parent-id": "CAP-001",
            "description": "Renew, save, and grow value with existing customers."
        },
        {
            "id": "CAP-001-05",
            "name": "Offboard Customer",
            "level": 2,
            "parent-id": "CAP-001",
            "description": "Manage the departure of customers, ensuring fair, transparent, and compliant exit from the portfolio."
        },
        {
            "id": "CAP-002-01",
            "name": "Plan Generation Capacity",
            "level": 2,
            "parent-id": "CAP-002",
            "description": "Forecast demand and plan generation mix and capacity additions."
        },
        {
            "id": "CAP-002-02",
            "name": "Operate Generation Assets",
            "level": 2,
            "parent-id": "CAP-002",
            "description": "Run generation assets safely, reliably, and economically against the dispatch schedule."
        },
        {
            "id": "CAP-002-03",
            "name": "Manage Fuel & Inputs",
            "level": 2,
            "parent-id": "CAP-002",
            "description": "Source, schedule, and manage fuel and other generation inputs."
        },
        {
            "id": "CAP-002-04",
            "name": "Optimise Generation Portfolio",
            "level": 2,
            "parent-id": "CAP-002",
            "description": "Optimise dispatch and unit commitment across the portfolio against price and constraint."
        },
        {
            "id": "CAP-003-01",
            "name": "Forecast Demand & Supply",
            "level": 2,
            "parent-id": "CAP-003",
            "description": "Forecast load, generation, and price across horizons."
        },
        {
            "id": "CAP-003-02",
            "name": "Trade Energy & Products",
            "level": 2,
            "parent-id": "CAP-003",
            "description": "Execute trades in wholesale and retail energy markets and adjacent products."
        },
        {
            "id": "CAP-003-03",
            "name": "Manage Trading Risk",
            "level": 2,
            "parent-id": "CAP-003",
            "description": "Measure and manage market, credit, and operational risk across the trading book."
        },
        {
            "id": "CAP-003-04",
            "name": "Settle Trades",
            "level": 2,
            "parent-id": "CAP-003",
            "description": "Confirm, invoice, and settle trades with counterparties and market operators."
        },
        {
            "id": "CAP-004-01",
            "name": "Plan Generation Investment",
            "level": 2,
            "parent-id": "CAP-004",
            "description": "Plan transmission and generation fleet development against load growth and policy."
        },
        {
            "id": "CAP-004-02",
            "name": "Operate Plant",
            "level": 2,
            "parent-id": "CAP-004",
            "description": "Run the network within operating limits, including balancing and constraint management."
        },
        {
            "id": "CAP-004-03",
            "name": "Maintain Plant",
            "level": 2,
            "parent-id": "CAP-004",
            "description": "Maintain and repair network assets to sustain reliability."
        },
        {
            "id": "CAP-004-04",
            "name": "Manage Outages",
            "level": 2,
            "parent-id": "CAP-004",
            "description": "Plan and respond to outages, restoration, and emergency events."
        },
        {
            "id": "CAP-004-05",
            "name": "Connect Customers & Generators",
            "level": 2,
            "parent-id": "CAP-004",
            "description": "Connect new loads and generators to the network."
        },
        {
            "id": "CAP-005-01",
            "name": "Plan Assets",
            "level": 2,
            "parent-id": "CAP-005",
            "description": "Develop the asset investment plan against demand, risk, and policy."
        },
        {
            "id": "CAP-005-02",
            "name": "Acquire & Construct Assets",
            "level": 2,
            "parent-id": "CAP-005",
            "description": "Procure, build, and commission new assets."
        },
        {
            "id": "CAP-005-03",
            "name": "Operate Assets",
            "level": 2,
            "parent-id": "CAP-005",
            "description": "Operate assets within their performance envelope."
        },
        {
            "id": "CAP-005-04",
            "name": "Maintain Assets",
            "level": 2,
            "parent-id": "CAP-005",
            "description": "Inspect, maintain, and repair assets over their lifecycle."
        },
        {
            "id": "CAP-005-05",
            "name": "Decommission Assets",
            "level": 2,
            "parent-id": "CAP-005",
            "description": "Retire and dispose of end-of-life assets."
        },
        {
            "id": "CAP-006-01",
            "name": "Manage Tariffs & Products",
            "level": 2,
            "parent-id": "CAP-006",
            "description": "Design and price retail energy products and tariffs."
        },
        {
            "id": "CAP-006-02",
            "name": "Read & Validate Meters",
            "level": 2,
            "parent-id": "CAP-006",
            "description": "Capture, validate, and estimate meter readings."
        },
        {
            "id": "CAP-006-03",
            "name": "Generate Bills",
            "level": 2,
            "parent-id": "CAP-006",
            "description": "Produce accurate, timely customer bills."
        },
        {
            "id": "CAP-006-04",
            "name": "Collect Payment",
            "level": 2,
            "parent-id": "CAP-006",
            "description": "Receive payment and manage payment methods."
        },
        {
            "id": "CAP-006-05",
            "name": "Manage Arrears",
            "level": 2,
            "parent-id": "CAP-006",
            "description": "Handle late payment, customer financial difficulty, and recovery."
        },
        {
            "id": "CAP-007-01",
            "name": "Manage Licensing",
            "level": 2,
            "parent-id": "CAP-007",